{
  "name": "My Token List",
  "timestamp": "2021-09-16T00:00:00+00:00",
  "tokens": [
    {
      "chainId": 1,
      "address": "8n5MZZr6RrtBhqM8H5qCKxQwZD5VJzVVZ6vVjiRCx7sL",
      "decimals": 6,
      "name": "Jordanian Dinar Digital Currency",
      "tags":["stable coin", "A token with value pegged to the value of Jordanian Dinar in 1 to 1"],
      "logoURI":"https://cdn.jsdelivr.net/gh/baselm/JODC@main/JODC_logo.png",
      "symbol": "JODC"
    }
  ],
  "version": {
    "major": 1,
    "minor": 0,
    "patch": 0
  }
}